{
  "title": "CapabilityDescriptor",
  "$schema": "https://json-schema.org/draft/2020-12/schema",
  "type": "object",
  "properties": {
    "id": {
      "type": "string",
      "minLength": 1
    },
    "risk": {
      "type": "string",
      "enum": [
        "safe",
        "normal",
        "dangerous"
      ]
    },
    "summary": {
      "type": "string",
      "minLength": 1
    },
    "parameters": {
      "type": "array",
      "items": {
        "type": "object",
        "properties": {
          "name": {
            "type": "string",
            "minLength": 1
          },
          "type": {
            "type": "string",
            "enum": [
              "string",
              "number",
              "boolean",
              "object",
              "array"
            ]
          },
          "required": {
            "type": "boolean"
          },
          "description": {
            "type": "string",
            "minLength": 1
          },
          "allowedValues": {
            "minItems": 1,
            "type": "array",
            "items": {
              "type": "string"
            }
          }
        },
        "required": [
          "name",
          "type",
          "required",
          "description"
        ],
        "additionalProperties": false
      }
    },
    "cliAlias": {
      "minItems": 1,
      "type": "array",
      "items": {
        "type": "string",
        "minLength": 1
      }
    }
  },
  "required": [
    "id",
    "risk",
    "summary",
    "parameters"
  ],
  "additionalProperties": false
}
